{
  "spec_version": "1.0",
  "lba_id": "example-agentic-pr-lba-0001",
  "use_case_id": "agentic_pull_request_preparation",
  "action_class_id": "repository_modifying_draft_pr_support",
  "policy_snapshot_hash": "example-policy-hash-current-agentic-software-policy",
  "lane_schema_hash": "example-lane-schema-hash-agentic-software-profile-v0.1",
  "evidence_refs": [
    "issue_042",
    "requirements_note_003",
    "test_plan_001"
  ],
  "approver_ids": [
    "responsible_repository_maintainer",
    "software_governance_lead"
  ],
  "approval_scope": {
    "allow": [
      "create feature branch",
      "edit files under src/example_module/",
      "add or modify tests under tests/example_module/",
      "update documentation directly related to issue_042",
      "open draft pull request for human review"
    ],
    "deny": [
      "modifying CI/CD workflow files",
      "changing deployment configuration",
      "accessing secrets",
      "modifying authentication or authorization logic",
      "self-approving pull requests",
      "merging pull requests",
      "triggering production deployment",
      "editing files outside declared scope"
    ],
    "notes": "Illustrative environment-neutral example only; not a valid operational LBA."
  },
  "issued_at": "2026-01-01T00:00:00Z",
  "expires_at": "2026-01-08T00:00:00Z",
  "non_delegation": true,
  "signatures": [
    {
      "signer_id": "example_repository_maintainer",
      "alg": "example",
      "sig": "example-signature-placeholder",
      "signed_at": "2026-01-01T00:00:00Z"
    }
  ]
}